{
 "evidence": {
  "artifact_version": "1.0",
  "evaluation_code_commit": "6b3124b176ea8ffaf198c3ee6aa966cd6a2eccb4",
  "evaluation_generated_at_utc": "2026-09-23T14:16:02+00:00",
  "feature_version": "0.2.0",
  "lab_contract_version": "1.0",
  "manifest_sha256_at_evaluation": "7b7bf2ae19b1ca9be5b389c81241c359679fb1a2e811efd8e9a33d3cfcafa066",
  "run_id": "20260923T140606+0000",
  "sensitivity_version": "1.0"
 },
 "lab_snapshot_version": "1.0",
 "methods": {
  "exact_v1": {
   "calibration": {
    "decision_level_brier": {
     "denominator": null,
     "numerator": null,
     "source_key": "artifacts/eval_exact_v1.json#metrics.calibration.decision_level.brier",
     "unavailable_reason": null,
     "value": 0.093735
    },
    "decision_level_ece": {
     "denominator": null,
     "numerator": null,
     "source_key": "artifacts/eval_exact_v1.json#metrics.calibration.decision_level.ece",
     "unavailable_reason": null,
     "value": 0.093735
    },
    "note": "The score is 0 or 1 and is used as the probability, so ECE equals the Brier score and both measure how often an exact hit is wrong and a miss is right; not a calibrated probability.",
    "pair_level_brier": {
     "denominator": null,
     "numerator": null,
     "source_key": "artifacts/eval_exact_v1.json#metrics.calibration.pair_level.brier",
     "unavailable_reason": null,
     "value": 0.012434
    },
    "pair_level_ece": {
     "denominator": null,
     "numerator": null,
     "source_key": "artifacts/eval_exact_v1.json#metrics.calibration.pair_level.ece",
     "unavailable_reason": null,
     "value": 0.012434
    }
   },
   "counts": {
    "accepted_all": {
     "source_key": "artifacts/mapping/mapping_exact_v1.test.csv.gz#tier=auto_accept rows",
     "value": 36529
    },
    "accepted_labelled": {
     "source_key": "artifacts/eval_exact_v1.json#metrics.at_auto_accept.accepted",
     "value": 35520
    },
    "accepted_or_review_labelled": {
     "source_key": "artifacts/eval_exact_v1.json#metrics.at_auto_accept_or_review.accepted",
     "value": 35717
    },
    "correct_labelled": {
     "source_key": "artifacts/eval_exact_v1.json#metrics.at_auto_accept.correct",
     "value": 35475
    },
    "correct_or_review_labelled": {
     "source_key": "artifacts/eval_exact_v1.json#metrics.at_auto_accept_or_review.correct",
     "value": 35671
    },
    "decisions_moved_to_review": {
     "source_key": "artifacts/eval_exact_v1.json#metrics.ambiguity_rule.decisions_moved_to_review",
     "value": 207
    },
    "exhibit_rows": {
     "source_key": "artifacts/mapping/mapping_exact_v1.test.csv.gz#rows",
     "value": 36736
    },
    "labelled_a": {
     "source_key": "artifacts/eval_exact_v1.json#metrics.labelled_a",
     "value": 48372
    },
    "labelled_a_reachable": {
     "source_key": "artifacts/eval_exact_v1.json#metrics.labelled_a_reachable",
     "value": 46625
    },
    "review_queue": {
     "source_key": "artifacts/eval_exact_v1.json#metrics.ambiguity_rule.review_queue",
     "value": 207
    },
    "test_a": {
     "source_key": "artifacts/eval_exact_v1.json#metrics.test_a",
     "value": 96557
    },
    "tier_auto_accept": {
     "source_key": "artifacts/mapping/mapping_exact_v1.test.csv.gz#tier=auto_accept rows",
     "value": 36529
    },
    "tier_reject": {
     "source_key": "artifacts/eval_exact_v1.json#metrics.test_a - artifacts/mapping/mapping_exact_v1.test.csv.gz#rows",
     "value": 59821
    },
    "tier_review": {
     "source_key": "artifacts/mapping/mapping_exact_v1.test.csv.gz#tier=review rows",
     "value": 207
    },
    "unverified_accepts": {
     "source_key": "artifacts/eval_exact_v1.json#metrics.unverified_accepts.count",
     "value": 1009
    }
   },
   "definition": "accept iff title_exact_norm and artist_full_exact and year_diff in {0, missing}; score in {0, 1} used as the probability; nothing fitted",
   "fitted_on": null,
   "legacy_threshold_sweep": {
    "chosen_accept_threshold": 0.95,
    "false_accept_cost_ratios": [
     1.0,
     5.0,
     20.0
    ],
    "note": "The accept-threshold sweep of the snapshot reused the ambiguity-demotion flag computed at the recorded accept threshold at every swept threshold. For thresholds below the recorded accept_min it can accept records whose top-2 gap is below ambiguity_gap; a faithful replay keeps them in review. Not an arbitrary-policy replay: see legacy_sweep_divergence in the replay bundle metadata.",
    "points": [
     {
      "accepts": 36529,
      "expected_false_accepts": 46.278,
      "precision_labelled": 0.998733,
      "queue_ambiguity": 207,
      "queue_floor": 0,
      "review_queue": 207,
      "threshold": 0.5,
      "total_cost": {
       "1": 253.278,
       "20": 1132.56,
       "5": 438.39
      }
     },
     {
      "accepts": 36529,
      "expected_false_accepts": 46.278,
      "precision_labelled": 0.998733,
      "queue_ambiguity": 207,
      "queue_floor": 0,
      "review_queue": 207,
      "threshold": 0.51,
      "total_cost": {
       "1": 253.278,
       "20": 1132.56,
       "5": 438.39
      }
     },
     {
      "accepts": 36529,
      "expected_false_accepts": 46.278,
      "precision_labelled": 0.998733,
      "queue_ambiguity": 207,
      "queue_floor": 0,
      "review_queue": 207,
      "threshold": 0.52,
      "total_cost": {
       "1": 253.278,
       "20": 1132.56,
       "5": 438.39
      }
     },
     {
      "accepts": 36529,
      "expected_false_accepts": 46.278,
      "precision_labelled": 0.998733,
      "queue_ambiguity": 207,
      "queue_floor": 0,
      "review_queue": 207,
      "threshold": 0.53,
      "total_cost": {
       "1": 253.278,
       "20": 1132.56,
       "5": 438.39
      }
     },
     {
      "accepts": 36529,
      "expected_false_accepts": 46.278,
      "precision_labelled": 0.998733,
      "queue_ambiguity": 207,
      "queue_floor": 0,
      "review_queue": 207,
      "threshold": 0.54,
      "total_cost": {
       "1": 253.278,
       "20": 1132.56,
       "5": 438.39
      }
     },
     {
      "accepts": 36529,
      "expected_false_accepts": 46.278,
      "precision_labelled": 0.998733,
      "queue_ambiguity": 207,
      "queue_floor": 0,
      "review_queue": 207,
      "threshold": 0.55,
      "total_cost": {
       "1": 253.278,
       "20": 1132.56,
       "5": 438.39
      }
     },
     {
      "accepts": 36529,
      "expected_false_accepts": 46.278,
      "precision_labelled": 0.998733,
      "queue_ambiguity": 207,
      "queue_floor": 0,
      "review_queue": 207,
      "threshold": 0.56,
      "total_cost": {
       "1": 253.278,
       "20": 1132.56,
       "5": 438.39
      }
     },
     {
      "accepts": 36529,
      "expected_false_accepts": 46.278,
      "precision_labelled": 0.998733,
      "queue_ambiguity": 207,
      "queue_floor": 0,
      "review_queue": 207,
      "threshold": 0.57,
      "total_cost": {
       "1": 253.278,
       "20": 1132.56,
       "5": 438.39
      }
     },
     {
      "accepts": 36529,
      "expected_false_accepts": 46.278,
      "precision_labelled": 0.998733,
      "queue_ambiguity": 207,
      "queue_floor": 0,
      "review_queue": 207,
      "threshold": 0.58,
      "total_cost": {
       "1": 253.278,
       "20": 1132.56,
       "5": 438.39
      }
     },
     {
      "accepts": 36529,
      "expected_false_accepts": 46.278,
      "precision_labelled": 0.998733,
      "queue_ambiguity": 207,
      "queue_floor": 0,
      "review_queue": 207,
      "threshold": 0.59,
      "total_cost": {
       "1": 253.278,
       "20": 1132.56,
       "5": 438.39
      }
     },
     {
      "accepts": 36529,
      "expected_false_accepts": 46.278,
      "precision_labelled": 0.998733,
      "queue_ambiguity": 207,
      "queue_floor": 0,
      "review_queue": 207,
      "threshold": 0.6,
      "total_cost": {
       "1": 253.278,
       "20": 1132.56,
       "5": 438.39
      }
     },
     {
      "accepts": 36529,
      "expected_false_accepts": 46.278,
      "precision_labelled": 0.998733,
      "queue_ambiguity": 207,
      "queue_floor": 0,
      "review_queue": 207,
      "threshold": 0.61,
      "total_cost": {
       "1": 253.278,
       "20": 1132.56,
       "5": 438.39
      }
     },
     {
      "accepts": 36529,
      "expected_false_accepts": 46.278,
      "precision_labelled": 0.998733,
      "queue_ambiguity": 207,
      "queue_floor": 0,
      "review_queue": 207,
      "threshold": 0.62,
      "total_cost": {
       "1": 253.278,
       "20": 1132.56,
       "5": 438.39
      }
     },
     {
      "accepts": 36529,
      "expected_false_accepts": 46.278,
      "precision_labelled": 0.998733,
      "queue_ambiguity": 207,
      "queue_floor": 0,
      "review_queue": 207,
      "threshold": 0.63,
      "total_cost": {
       "1": 253.278,
       "20": 1132.56,
       "5": 438.39
      }
     },
     {
      "accepts": 36529,
      "expected_false_accepts": 46.278,
      "precision_labelled": 0.998733,
      "queue_ambiguity": 207,
      "queue_floor": 0,
      "review_queue": 207,
      "threshold": 0.64,
      "total_cost": {
       "1": 253.278,
       "20": 1132.56,
       "5": 438.39
      }
     },
     {
      "accepts": 36529,
      "expected_false_accepts": 46.278,
      "precision_labelled": 0.998733,
      "queue_ambiguity": 207,
      "queue_floor": 0,
      "review_queue": 207,
      "threshold": 0.65,
      "total_cost": {
       "1": 253.278,
       "20": 1132.56,
       "5": 438.39
      }
     },
     {
      "accepts": 36529,
      "expected_false_accepts": 46.278,
      "precision_labelled": 0.998733,
      "queue_ambiguity": 207,
      "queue_floor": 0,
      "review_queue": 207,
      "threshold": 0.66,
      "total_cost": {
       "1": 253.278,
       "20": 1132.56,
       "5": 438.39
      }
     },
     {
      "accepts": 36529,
      "expected_false_accepts": 46.278,
      "precision_labelled": 0.998733,
      "queue_ambiguity": 207,
      "queue_floor": 0,
      "review_queue": 207,